{
  "$schema": "http://json-schema.org/draft-07/schema#",
  "$id": "https://frootai.dev/schemas/plugin.schema.json",
  "title": "FrootAI Plugin Schema",
  "description": "Validates plugin.json — themed bundles of agents, skills, instructions, and hooks that ship as installable packages.",
  "type": "object",
  "required": [
    "name",
    "description",
    "version",
    "author",
    "license"
  ],
  "properties": {
    "name": {
      "type": "string",
      "pattern": "^[a-z0-9]([a-z0-9-]*[a-z0-9])?$",
      "minLength": 3,
      "maxLength": 64,
      "description": "Kebab-case plugin identifier. Must match the plugin folder name."
    },
    "description": {
      "type": "string",
      "minLength": 10,
      "maxLength": 500,
      "description": "What this plugin provides — displayed in marketplace and discovery."
    },
    "version": {
      "type": "string",
      "pattern": "^[0-9]+\\.[0-9]+\\.[0-9]+(-[a-z0-9.]+)?$",
      "description": "Semantic version (e.g., 1.0.0, 2.1.0-beta.1)."
    },
    "author": {
      "type": "object",
      "required": [
        "name"
      ],
      "properties": {
        "name": {
          "type": "string",
          "minLength": 1,
          "description": "Author or organization name."
        },
        "email": {
          "type": "string",
          "format": "email",
          "description": "Contact email (optional)."
        },
        "url": {
          "type": "string",
          "format": "uri",
          "description": "Author website (optional)."
        }
      },
      "additionalProperties": false
    },
    "license": {
      "type": "string",
      "description": "SPDX license identifier (e.g., MIT, Apache-2.0).",
      "examples": [
        "MIT",
        "Apache-2.0"
      ]
    },
    "repository": {
      "type": "string",
      "format": "uri",
      "description": "GitHub repository URL."
    },
    "homepage": {
      "type": "string",
      "format": "uri",
      "description": "Plugin homepage or documentation URL."
    },
    "keywords": {
      "type": "array",
      "items": {
        "type": "string",
        "pattern": "^[a-z0-9-]+$",
        "maxLength": 32
      },
      "maxItems": 20,
      "uniqueItems": true,
      "description": "Discovery tags for marketplace search. 5-15 recommended."
    },
    "agents": {
      "type": "array",
      "items": {
        "type": "string",
        "minLength": 1
      },
      "description": "Paths to bundled agent folders or files (relative to plugin root)."
    },
    "skills": {
      "type": "array",
      "items": {
        "type": "string",
        "minLength": 1
      },
      "description": "Paths to bundled skill folders (relative to plugin root)."
    },
    "instructions": {
      "type": "array",
      "items": {
        "type": "string",
        "minLength": 1
      },
      "description": "Paths to bundled instruction files (relative to plugin root)."
    },
    "hooks": {
      "type": "array",
      "items": {
        "type": "string",
        "minLength": 1
      },
      "description": "Paths to bundled hook folders (relative to plugin root)."
    },
    "plays": {
      "type": "array",
      "items": {
        "type": "string",
        "pattern": "^[0-9]{2}(-[a-z0-9-]+)?$"
      },
      "description": "Solution play IDs this plugin is designed for. FAI Layer auto-wires all bundled primitives when used inside a play."
    },
    "components": {
      "type": "array",
      "items": {
        "type": "string",
        "minLength": 1
      },
      "description": "Paths (relative to plugin root) to JSON files describing custom scaffold_component templates. v6.8+. Each file must conform to ComponentDefinition (id, name, languages, description, waf, plays?, templates)."
    },
    "playTemplates": {
      "type": "array",
      "items": {
        "type": "string",
        "minLength": 1
      },
      "description": "Paths (relative to plugin root) to JSON files describing custom solution-play templates surfaced by get_play_config / get_dependencies / agent_build. v6.8+."
    },
    "bicepTemplates": {
      "type": "array",
      "items": {
        "type": "string",
        "minLength": 1
      },
      "description": "Paths (relative to plugin root) to JSON files describing custom Bicep play infra mappings (PlayInfra) used by generate_bicep. v6.8+."
    },
    "reviewRules": {
      "type": "array",
      "items": {
        "type": "string",
        "minLength": 1
      },
      "description": "Paths (relative to plugin root) to .js modules exporting Rule objects for the agent_review engine. v6.8+. SECURITY: review-rule modules execute JavaScript — only install plugins you trust. Disable via FAI_PLUGIN_LOAD_DISABLED=1."
    }
  },
  "additionalProperties": false
}