{
  "name": "responsible-ai",
  "description": "Responsible AI — content safety, bias testing, fairness metrics, transparency cards.",
  "version": "1.0.0",
  "author": {
    "name": "FAI Contributors",
    "url": "https://frootai.dev"
  },
  "repository": "https://github.com/frootai/frootai",
  "license": "MIT",
  "keywords": [
    "responsible-ai",
    "content-safety",
    "bias",
    "fairness",
    "transparency",
    "human-in-the-loop",
    "eu-ai-act",
    "ethics"
  ],
  "agents": [
    "../../agents/fai-responsible-ai-reviewer.agent.md",
    "../../agents/fai-content-safety-expert.agent.md",
    "../../agents/fai-red-team-expert.agent.md"
  ],
  "instructions": [
    "../../instructions/rai-content-safety.instructions.md",
    "../../instructions/rai-bias-testing.instructions.md",
    "../../instructions/responsible-ai-coding.instructions.md",
    "../../instructions/agent-safety.instructions.md"
  ],
  "skills": [
    "../../skills/fai-content-safety-review/",
    "../../skills/fai-human-in-the-loop/",
    "../../skills/fai-guardrails-policy/",
    "../../skills/fai-gdpr-compliance/"
  ],
  "hooks": [
    "../../hooks/fai-secrets-scanner/",
    "../../hooks/fai-tool-guardian/",
    "../../hooks/fai-governance-audit/",
    "../../hooks/fai-pii-redactor/",
    "../../hooks/fai-output-validator/"
  ]
}