{
  "name": "content-moderation",
  "description": "Content Moderation — real-time text, image, and multi-modal content safety with Azure AI Content Safety. Includes severity scoring.",
  "version": "1.0.0",
  "author": {
    "name": "FAI Contributors",
    "url": "https://frootai.dev"
  },
  "repository": "https://github.com/frootai/frootai",
  "license": "MIT",
  "keywords": [
    "content-moderation",
    "content-safety",
    "azure-ai",
    "image-moderation",
    "text-moderation",
    "blocklist",
    "responsible-ai"
  ],
  "agents": [
    "../../agents/fai-play-10-builder.agent.md",
    "../../agents/fai-play-10-reviewer.agent.md",
    "../../agents/fai-play-10-tuner.agent.md",
    "../../agents/fai-content-safety-expert.agent.md",
    "../../agents/fai-responsible-ai-reviewer.agent.md"
  ],
  "instructions": [
    "../../instructions/content-moderation-patterns.instructions.md",
    "../../instructions/rai-content-safety.instructions.md",
    "../../instructions/rai-bias-testing.instructions.md"
  ],
  "skills": [
    "../../skills/fai-deploy-10-content-moderation/",
    "../../skills/fai-evaluate-10-content-moderation/",
    "../../skills/fai-tune-10-content-moderation/",
    "../../skills/fai-content-safety-review/",
    "../../skills/fai-human-in-the-loop/"
  ],
  "hooks": [
    "../../hooks/fai-secrets-scanner/",
    "../../hooks/fai-tool-guardian/",
    "../../hooks/fai-governance-audit/",
    "../../hooks/fai-pii-redactor/",
    "../../hooks/fai-output-validator/"
  ],
  "plays": [
    "10-content-moderation"
  ]
}