{
  "name": "edge-ai-phi4",
  "description": "Edge AI with Phi-4 — deploy small language models on edge devices, IoT hubs, and local inference servers. Quantization, ONNX optimization, and offline-capable AI with Microsoft Phi-4 models.",
  "version": "1.0.0",
  "author": {
    "name": "FrootAI Contributors",
    "url": "https://frootai.dev"
  },
  "repository": "https://github.com/frootai/frootai",
  "license": "MIT",
  "keywords": [
    "edge-ai",
    "phi-4",
    "onnx",
    "quantization",
    "iot",
    "local-inference",
    "small-language-model",
    "offline"
  ],
  "agents": [
    "../../agents/frootai-play-19-builder.agent.md",
    "../../agents/frootai-play-19-reviewer.agent.md",
    "../../agents/frootai-play-19-tuner.agent.md",
    "../../agents/frootai-ml-engineer.agent.md"
  ],
  "instructions": [
    "../../instructions/play-19-edge-ai-phi4-patterns.instructions.md",
    "../../instructions/python-waf.instructions.md",
    "../../instructions/docker-waf.instructions.md"
  ],
  "skills": [
    "../../skills/frootai-deploy-19-edge-ai-phi4/",
    "../../skills/frootai-evaluate-19-edge-ai-phi4/",
    "../../skills/frootai-tune-19-edge-ai-phi4/",
    "../../skills/frootai-inference-optimization/",
    "../../skills/frootai-multi-stage-docker/"
  ],
  "hooks": [
    "../../hooks/frootai-secrets-scanner/",
    "../../hooks/frootai-tool-guardian/",
    "../../hooks/frootai-governance-audit/",
    "../../hooks/frootai-cost-tracker/"
  ],
  "plays": [
    "19-edge-ai-phi4"
  ]
}
