{
  "name": "ai-search-portal",
  "description": "AI Search Portal — full-text and vector hybrid search with semantic ranking, faceted navigation, autocomplete, and personalized results. Build a production search experience on Azure AI Search with RAG integration.",
  "version": "1.0.0",
  "author": {
    "name": "FrootAI Contributors",
    "url": "https://frootai.dev"
  },
  "repository": "https://github.com/frootai/frootai",
  "license": "MIT",
  "keywords": [
    "ai-search",
    "vector-search",
    "semantic-ranking",
    "hybrid-search",
    "faceted-navigation",
    "azure-ai-search",
    "rag"
  ],
  "agents": [
    "../../agents/frootai-play-09-builder.agent.md",
    "../../agents/frootai-play-09-reviewer.agent.md",
    "../../agents/frootai-play-09-tuner.agent.md",
    "../../agents/frootai-azure-ai-search-expert.agent.md",
    "../../agents/frootai-embedding-expert.agent.md"
  ],
  "instructions": [
    "../../instructions/play-09-ai-search-portal-patterns.instructions.md",
    "../../instructions/python-waf.instructions.md",
    "../../instructions/nextjs-waf.instructions.md"
  ],
  "skills": [
    "../../skills/frootai-deploy-09-ai-search-portal/",
    "../../skills/frootai-evaluate-09-ai-search-portal/",
    "../../skills/frootai-tune-09-ai-search-portal/",
    "../../skills/frootai-azure-ai-search-index/",
    "../../skills/frootai-build-semantic-search/"
  ],
  "hooks": [
    "../../hooks/frootai-secrets-scanner/",
    "../../hooks/frootai-tool-guardian/",
    "../../hooks/frootai-governance-audit/"
  ],
  "plays": [
    "09-ai-search-portal"
  ]
}
