{
  "name": "python-fullstack",
  "description": "Python Full-Stack — FastAPI, Django, Flask, Pydantic, SQLAlchemy, pytest, and async patterns. Data science to web APIs with type safety.",
  "version": "1.0.0",
  "author": {
    "name": "FAI Contributors",
    "url": "https://frootai.dev"
  },
  "repository": "https://github.com/frootai/frootai",
  "license": "MIT",
  "keywords": [
    "python",
    "fastapi",
    "django",
    "flask",
    "pydantic",
    "sqlalchemy",
    "pytest",
    "async"
  ],
  "agents": [
    "../../agents/fai-python-expert.agent.md",
    "../../agents/fai-python-mcp-expert.agent.md"
  ],
  "instructions": [
    "../../instructions/python-waf.instructions.md",
    "../../instructions/fastapi-waf.instructions.md",
    "../../instructions/django-waf.instructions.md",
    "../../instructions/flask-waf.instructions.md",
    "../../instructions/pydantic-waf.instructions.md",
    "../../instructions/sqlalchemy-waf.instructions.md",
    "../../instructions/pytest-waf.instructions.md"
  ],
  "skills": [
    "../../skills/fai-fastapi-scaffold/",
    "../../skills/fai-pytest-coverage/",
    "../../skills/fai-playwright-python-test/"
  ],
  "hooks": [
    "../../hooks/fai-secrets-scanner/",
    "../../hooks/fai-tool-guardian/",
    "../../hooks/fai-governance-audit/"
  ]
}